{
  "schemaVersion": 1,
  "gameBuild": "25677108",
  "trees": [
    {
      "role": "Driver",
      "rows": 4,
      "columns": 9,
      "shape": "Circle"
    },
    {
      "role": "Infantry",
      "rows": 4,
      "columns": 9,
      "shape": "Circle"
    },
    {
      "role": "Medic",
      "rows": 4,
      "columns": 9,
      "shape": "Circle"
    },
    {
      "role": "Pilot",
      "rows": 4,
      "columns": 9,
      "shape": "Circle"
    },
    {
      "role": "Recon",
      "rows": 4,
      "columns": 9,
      "shape": "Circle"
    },
    {
      "role": "Support",
      "rows": 4,
      "columns": 9,
      "shape": "Circle"
    }
  ],
  "skills": [
    {
      "id": "Driver.AimDownSightSpeed.MountedGun",
      "role": "Driver",
      "name": "Time-to-ADS speed improvement (Mounted MG - Ground Vehicles)",
      "description": "Reduces the amount of time it takes to enter ADS whilst using any mounted MG's on ground vehicles.",
      "layout": {
        "row": 2,
        "column": 5,
        "x": 1198.774,
        "y": 320.773
      },
      "effects": [
        {
          "trigger": "Item",
          "effect": "GE_Weapon_AimTime",
          "attribute": "Weapon.AimTime",
          "curve": "AimDownSight_MountedGun",
          "levels": [
            {
              "level": 0,
              "value": 1
            },
            {
              "level": 2,
              "value": 0.8
            },
            {
              "level": 3,
              "value": 0.7
            },
            {
              "level": 4,
              "value": 0.6
            }
          ]
        }
      ]
    },
    {
      "id": "Driver.AutoRepair",
      "role": "Driver",
      "name": "Can autorepair at petrol stations (Ground Vehicles)",
      "description": "Unlocks the ability to auto repair ground vehicles at a petrol station.",
      "layout": {
        "row": 1,
        "column": 2,
        "x": 580.691,
        "y": 594.642
      },
      "effects": []
    },
    {
      "id": "Driver.FuelUsageReduction",
      "role": "Driver",
      "name": "Fuel usage rate reduction (Ground Vehicles)",
      "description": "Reduces the usage of fuel when driving ground vehicles, providing a longer fuel time.",
      "layout": {
        "row": 1,
        "column": 5,
        "x": 1134.646,
        "y": 496.965
      },
      "effects": [
        {
          "trigger": "Vehicle",
          "effect": "GE_Vehicle_FuelUsageReductionMultiplier",
          "attribute": "FuelUsageReductionMultiplier",
          "curve": "FuelUsageReduction",
          "levels": [
            {
              "level": 0,
              "value": 1
            },
            {
              "level": 2,
              "value": 0.8
            },
            {
              "level": 3,
              "value": 0.7
            },
            {
              "level": 4,
              "value": 0.6
            }
          ]
        }
      ]
    },
    {
      "id": "Driver.HorizontalRecoil.MountedGun",
      "role": "Driver",
      "name": "Horizontal recoil reduction (Mounted MG - Ground Vehicles)",
      "description": "Reduces horizontal recoil experienced when firing a mounted MG on a ground vehicle.",
      "layout": {
        "row": 0,
        "column": 1,
        "x": 617.5,
        "y": 838.043
      },
      "effects": [
        {
          "trigger": "Item",
          "effect": "GE_Weapon_HorizontalRecoilMultiplier",
          "attribute": "Weapon.HorizontalRecoilMultiplier",
          "curve": "HorizontalRecoil_MountedGun",
          "levels": [
            {
              "level": 0,
              "value": 1
            },
            {
              "level": 2,
              "value": 0.8
            },
            {
              "level": 3,
              "value": 0.7
            },
            {
              "level": 4,
              "value": 0.6
            }
          ]
        }
      ]
    },
    {
      "id": "Driver.ImpactDamageReduction",
      "role": "Driver",
      "name": "Impact damage reduction (Ground Vehicles)",
      "description": "Reduces the amount of damage your ground vehicle receives from impacting with objects & landscape in the world (when you are driver).",
      "layout": {
        "row": 1,
        "column": 1,
        "x": 455.12,
        "y": 744.292
      },
      "effects": [
        {
          "trigger": "Vehicle",
          "effect": "GE_Vehicle_ImpactReductionMultiplier",
          "attribute": "Health.ImpactReductionMultiplier",
          "curve": "ImpactDamageReduction",
          "levels": [
            {
              "level": 0,
              "value": 1
            },
            {
              "level": 2,
              "value": 0.8
            },
            {
              "level": 3,
              "value": 0.7
            },
            {
              "level": 4,
              "value": 0.6
            }
          ]
        }
      ]
    },
    {
      "id": "Driver.IncreasedHealth.SupplyCrate",
      "role": "Driver",
      "name": "Increased supply crate durability (Ground Vehicles)",
      "description": "Increases the amount of damage a supply crate can take before it is destroyed (when the supply crate is dropped by you as a driver)",
      "layout": {
        "row": 2,
        "column": 4,
        "x": 942.259,
        "y": 275.542
      },
      "effects": [
        {
          "trigger": "SupplyCrate",
          "effect": "GE_Vehicle_Health",
          "attribute": "Health",
          "curve": "IncreasedHealth_SupplyCrate",
          "levels": [
            {
              "level": 0,
              "value": 1
            },
            {
              "level": 2,
              "value": 1.2
            },
            {
              "level": 4,
              "value": 1.4
            }
          ]
        }
      ]
    },
    {
      "id": "Driver.QuickerEngineStart",
      "role": "Driver",
      "name": "Engine turn on speed improvement",
      "description": "Reduces the time it takes to turn the engine on in ground vehicles.",
      "layout": {
        "row": 1,
        "column": 4,
        "x": 942.259,
        "y": 463.042
      },
      "effects": []
    },
    {
      "id": "Driver.RefuelSpeed.PetrolStation",
      "role": "Driver",
      "name": "Petrol station refueling speed improvement (Ground Vehicles)",
      "description": "Reduces the amount of time it takes to refuel a ground vehicle at a petrol station.",
      "layout": {
        "row": 1,
        "column": 6,
        "x": 1303.827,
        "y": 594.642
      },
      "effects": []
    },
    {
      "id": "Driver.RefuelSpeed.Spawn",
      "role": "Driver",
      "name": "Spawnzone refueling speed improvement (Ground Vehicles)",
      "description": "Reduces the amount of time it takes to refuel a ground vehicle in the spawnzone.",
      "layout": {
        "row": 1,
        "column": 7,
        "x": 1429.398,
        "y": 744.292
      },
      "effects": []
    },
    {
      "id": "Driver.ReloadSpeed.MountedGun",
      "role": "Driver",
      "name": "Reload speed improvement (Mounted MG - Ground Vehicles)",
      "description": "Reduces the amount of time it takes to reload the mounted MG's on ground vehicles.",
      "layout": {
        "row": 2,
        "column": 3,
        "x": 685.744,
        "y": 320.773
      },
      "effects": []
    },
    {
      "id": "Driver.RepairSpeed.Spawn",
      "role": "Driver",
      "name": "Spawnzone Repairing speed improvement (Ground Vehicles)",
      "description": "Reduces the amount of time it takes to repair a ground vehicle in the spawnzone.",
      "layout": {
        "row": 1,
        "column": 3,
        "x": 749.873,
        "y": 496.965
      },
      "effects": []
    },
    {
      "id": "Driver.VerticalRecoil.MountedGun",
      "role": "Driver",
      "name": "Vertical recoil reduction (Mounted MG - Ground Vehicles)",
      "description": "Reduces vertical recoil experienced when firing a mounted MG on a ground vehicle.",
      "layout": {
        "row": 0,
        "column": 7,
        "x": 1267.019,
        "y": 838.042
      },
      "effects": [
        {
          "trigger": "Item",
          "effect": "GE_Weapon_VerticalRecoilMultiplier",
          "attribute": "Weapon.VerticalRecoilMultiplier",
          "curve": "VerticalRecoil_MountedGun",
          "levels": [
            {
              "level": 0,
              "value": 1
            },
            {
              "level": 2,
              "value": 0.8
            },
            {
              "level": 3,
              "value": 0.7
            },
            {
              "level": 4,
              "value": 0.6
            }
          ]
        }
      ]
    },
    {
      "id": "Infantry.AimDownSightSpeed.AssaultRifle",
      "role": "Infantry",
      "name": "Time-to-ADS speed improvement (Assault Archetype)",
      "description": "Reduces the time it takes to enter ADS, specifically with weapons within the 'assault' archetype.",
      "layout": {
        "row": 2,
        "column": 3,
        "x": 685.744,
        "y": 320.773
      },
      "effects": [
        {
          "trigger": "Item",
          "effect": "GE_Weapon_AimTime",
          "attribute": "Weapon.AimTime",
          "curve": "AimDownSightSpeed_AssaultRifle",
          "levels": [
            {
              "level": 0,
              "value": 1
            },
            {
              "level": 2,
              "value": 0.8
            },
            {
              "level": 3,
              "value": 0.7
            },
            {
              "level": 4,
              "value": 0.6
            }
          ]
        }
      ]
    },
    {
      "id": "Infantry.AimDownSightSpeed.SMG",
      "role": "Infantry",
      "name": "Time-to-ADS speed improvement (SMG Archetype)",
      "description": "Reduces the time it takes to enter ADS, specifically with weapons within the 'SMG' archetypes.",
      "layout": {
        "row": 2,